### ISSUE TITLE
check_ping randomly reports OK even though device is unplugged

### ISSUE THREAD

**Issue by preisi** [monitoring-plugins/monitoring-plugins#2019]
I have several devices which are currently unplugged. However, `check_ping` randomly and non-reproducibly reports them as online.

In order to verify that no other device has assumed the ip address of the offline devices,  I have already monitored the incoming and outgoing ICMP packets on the  server invoking the `check_ping`-command.
And indeed, `tcpdump` does not report any incoming ICMP echo replies for the ip addresses in question (while it still does for actually online devices ;-))

Nonetheless, according to icinga2's debug log `check_ping` sometimes returns with exit code 0 and some random(?)  results. Here, the relevant (and redacted) excerpt from the logs:
```
[2024-09-11 18:52:05 +0200] notice/Process: Running command '/usr/lib/nagios/plugins/check_ping' '-H' '$IP_OF_UNPLUGGED_DEVICE' '-c' '5000,100%' '-w' '3000,80%': PID 1003007
[2024-09-11 18:52:11 +0200] notice/Process: PID 1003007 ('/usr/lib/nagios/plugins/check_ping' '-H' '$IP_OF_UNPLUGGED_DEVICE' '-c' '5000,100%' '-w' '3000,80%') terminated with exit code 0
[2024-09-11 18:52:11 +0200] notice/Checkable: State Change: Checkable '$UNPLUGGED_DEVICE' hard state change from DOWN to UP detected.
[2024-09-11 18:52:11 +0200] notice/Process: Running command '/etc/icinga2/scripts/mail-host-notification.sh' '-4' '$IP_OF_UNPLUGGED_DEVICE' '-6' '' '-b' '' '-c' '' '-d' '2024-09-11 18:52:11 +0200' '-l' '$UNPLUGGED_DEVICE' '-n' '$UNPLUGGED_DEVICE_NAME' '-o' 'PING OK - Packet loss = 16%, RTA = 3.43 ms' '-r' '$SOME_MAIL_ADDRESS' '-s' 'UP' '-t' 'RECOVERY' '-v' 'false': PID 1003068
```

Also, for completeness, here the (also redacted) `tcpdump` output:
```
18:52:05.889240 IP $MONITORING_SERVER > $UNPLUGGED_DEVICE: ICMP echo request, id 32841, seq 1, length 64
18:52:06.893829 IP $MONITORING_SERVER > $UNPLUGGED_DEVICE: ICMP echo request, id 32841, seq 2, length 64
18:52:07.896046 IP $MONITORING_SERVER > $UNPLUGGED_DEVICE: ICMP echo request, id 32841, seq 3, length 64
18:52:08.898848 IP $MONITORING_SERVER > $UNPLUGGED_DEVICE: ICMP echo request, id 32841, seq 4, length 64
18:52:09.900242 IP $MONITORING_SERVER > $UNPLUGGED_DEVICE: ICMP echo request, id 32841, seq 5, length 64
18:52:10.900233 IP $MONITORING_SERVER > $UNPLUGGED_DEVICE: ICMP echo request, id 32841, seq 6, length 64
18:52:12.445444 IP $MONITORING_SERVER > $UNPLUGGED_DEVICE: ICMP echo request, id 55042, seq 1, length 64
18:52:13.448238 IP $MONITORING_SERVER > $UNPLUGGED_DEVICE: ICMP echo request, id 55042, seq 2, length 64
18:52:14.472242 IP $MONITORING_SERVER > $UNPLUGGED_DEVICE: ICMP echo request, id 55042, seq 3, length 64
18:52:15.500241 IP $MONITORING_SERVER > $UNPLUGGED_DEVICE: ICMP echo request, id 55042, seq 4, length 64
18:52:16.520186 IP $MONITORING_SERVER > $UNPLUGGED_DEVICE: ICMP echo request, id 55042, seq 5, length 64
18:52:17.544242 IP $MONITORING_SERVER > $UNPLUGGED_DEVICE: ICMP echo request, id 55042, seq 6, length 64
18:52:18.568216 IP $MONITORING_SERVER > $UNPLUGGED_DEVICE: ICMP echo request, id 55042, seq 7, length 64
18:52:19.592245 IP $MONITORING_SERVER > $UNPLUGGED_DEVICE: ICMP echo request, id 55042, seq 8, length 64
18:52:20.616186 IP $MONITORING_SERVER > $UNPLUGGED_DEVICE: ICMP echo request, id 55042, seq 9, length 64
18:52:21.640236 IP $MONITORING_SERVER > $UNPLUGGED_DEVICE: ICMP echo request, id 55042, seq 10, length 64
```

The logs further show that `check_ping` already returns with exit code 0 while ICMP packets are still being dispatched for almost 10 more seconds. However, I'm not sure how accurate the timestamps provided by icinga2's log actually are.
Also, in this faulty case `check_ping` only sends 10 ICMP requests whereas in the normal case it is 30 before it reports the system as unavailable.

**Comment by RincewindsHat** [comment]
Since I am not sure whether I find time to debug `check_ping` (and my motivation for "parse what ping(8) prints" is pretty low, I could offer you the workaround/suggestion of trying `check_icmp`.

**Comment by RincewindsHat** [comment]
And thank you for reporting that issue
